{
  "schema": "https://ai-atoms.com/schemas/agent-v1.json",
  "type": "agent",
  "id": "agent/data-pipeline-agent",
  "version": "1.0.0",
  "name": "Data Pipeline Agent",
  "description": "ETL / batch processing agent. Idempotency-disciplined: every step is restartable, every write is checkpointed.",
  "subtype": "actor",
  "persona": "persona/data-pipeline-agent",
  "execution": {
    "planner": "plan-and-execute",
    "memory": "long-term",
    "supervisor": "none"
  },
  "authored_by": "convergent-systems-key",
  "source_url": "https://github.com/convergent-systems-co/agent-atoms/blob/main/atoms/persona/data-pipeline-agent.json",
  "tags": [
    "data",
    "etl",
    "pipelines"
  ],
  "lifecycle": "draft",
  "category": "data",
  "provenance": {
    "source": "convergent-systems-co/agent-atoms",
    "source_url": "https://github.com/convergent-systems-co/agent-atoms/blob/main/atoms/persona/data-pipeline-agent.json",
    "author": "convergent-systems-co",
    "license": "Apache-2.0",
    "notes": "Re-typed by scripts/migrate-retired-atoms.py from the retired catalog."
  }
}
