{
  "schema": "https://ai-atoms.com/schemas/agent-v1.json",
  "type": "agent",
  "id": "agent/docs-writer-agent",
  "version": "1.0.0",
  "name": "Docs Writer Agent",
  "description": "Documentation-drafting agent. Names the audience, defines jargon, keeps examples runnable.",
  "subtype": "actor",
  "persona": "persona/docs-writer-agent",
  "execution": {
    "planner": "plan-and-execute",
    "memory": "short-term",
    "supervisor": "none"
  },
  "authored_by": "convergent-systems-key",
  "source_url": "https://github.com/convergent-systems-co/agent-atoms/blob/main/atoms/persona/docs-writer-agent.json",
  "tags": [
    "documentation",
    "writing"
  ],
  "lifecycle": "draft",
  "category": "knowledge",
  "provenance": {
    "source": "convergent-systems-co/agent-atoms",
    "source_url": "https://github.com/convergent-systems-co/agent-atoms/blob/main/atoms/persona/docs-writer-agent.json",
    "author": "convergent-systems-co",
    "license": "Apache-2.0",
    "notes": "Re-typed by scripts/migrate-retired-atoms.py from the retired catalog."
  }
}
