{
  "schema": "https://ai-atoms.com/schemas/agent-v1.json",
  "type": "agent",
  "id": "agent/planner-agent",
  "version": "1.0.0",
  "name": "Planner Agent",
  "description": "Decomposition-first agent. Builds Alternatives Tables, sequences work, surfaces risk before any execution.",
  "subtype": "actor",
  "persona": "persona/planner-agent",
  "execution": {
    "planner": "tree-of-thoughts",
    "memory": "long-term",
    "supervisor": "none"
  },
  "authored_by": "convergent-systems-key",
  "source_url": "https://github.com/convergent-systems-co/agent-atoms/blob/main/atoms/persona/planner-agent.json",
  "tags": [
    "planning",
    "decomposition"
  ],
  "lifecycle": "draft",
  "category": "product",
  "provenance": {
    "source": "convergent-systems-co/agent-atoms",
    "source_url": "https://github.com/convergent-systems-co/agent-atoms/blob/main/atoms/persona/planner-agent.json",
    "author": "convergent-systems-co",
    "license": "Apache-2.0",
    "notes": "Re-typed by scripts/migrate-retired-atoms.py from the retired catalog."
  }
}
